title,companyname,location,salary,summary,description
"Startup seeks Business Development Manager or Exec with sky-...",Staple,Singapore,"$3,500 - $5,500 a month","Our technology harnesses machine learning, computer vision and OCR to standardise data and deliver data insights to our users..
Be business fluent in English.",None
"Data Scientist","KKT TECHNOLOGY PTE. LTD.",Queenstown,"$3,700 - $5,500 a month","As a junior data scientist you will be involved in all aspects of the data driven decision making process -data processing, model conceptualization, innovation,…","Roles & Responsibilities
Job Description & Requirements
At Holmusk we leverage data and advanced analytics to accelerate research and improve outcomes in behavioural health and chronic diseases. We focus on harnessing actionable insights from data for pharma, providers and payers. We develop predictive models based on real-world data and deploy them for patients and clinicians using solutions, such as, mobile apps and EMR integrated web apps.
As a junior data scientist you will be involved in all aspects of the data driven decision making process -data processing, model conceptualization, innovation, development and testing. You also get a chance to present the meaningful insights to the different levels of healthcare stakeholders and make a change.

Responsibilities
Develop predictive models on clinical and healthcare related datasets to address various business problems of healthcare and pharma clients through leveraging advanced statistical modeling, machine learning, or data mining techniques
Engage in both exploratory data analysis to identify trends and predictive data analysis to solve problems
Understand client needs, frame a problem in terms of application of data science and create a roadmap to execution
Learn about new and varied disease conditions and ability to communicate with subject matter experts
Create visualizations to effectively communicate the insights both internally and externally for both scientific and business audience

Requirements
Minimum
Understanding of statistical modeling, machine learning, data mining concepts and optimization techniques
Proficiency in Python
Experience with software development tools like Linux command line utilities, version control systems (git strongly preferred) and test-driven development
Familiarity with one or more machine learning and statistical modeling tools, such as statsmodels/lifelines, scikit-learn, Keras, TensorFlow, PyTorch
Strong analytical and quantitative problem-solving ability
Excellent communication, interpersonal relationship skills and a strong team player

Preferred
Knowledge and experience of working with relational databases and SQL
Strong knowledge of mathematics [CANDIDATES WHO REQUIRE WORK PASSES NEED NOT APPLY]

[CANDIDATES WHO REQUIRE WORK PASSES NEED NOT APPLY]"
"Data Scientist","NextWave Partners",Singapore,None,"Work on core data science projects.
End to end data science solutions and model creation from data extraction, algorithm selection, to building and testing.","AdTech company with a revolutionary product
End to end data science solutions
Work on core data science projects
Contract role with the potential to convert to perm (full time) subject to performance
We are looking for a Data Scientist to join a forward-thinking tech company with responsibilities to solve business problems within the marketing and advertising industry.
Working with the technical team, you will be responsible for devising solutions to business and operational challenges, working with large data sets consisting of both structured and unstructured data.
Responsibilities
Develop data pipelines with automated and machine learning systems
Develop predictive models with monetized features
End to end data science solutions and model creation from data extraction, algorithm selection, to building and testing.
Build complex models and perform exploratory analysis on structured and unstructured data sets to extract insights
Research new machine learning solutions and algorithms to solve real life business problems
Strategize model testing and performance measuring with the objective of refining and improving the systems currently in place and act as a consultant to clients/users.
Identify and analyze new data sets based on business requirements and develop presentations to communicate insights
Requirements
Minimum three (3) years of experience in data science/analytics
Minimum Master’s degree in Computer Science, Engineering, Statistics or related field
Proficient in Python, SQL, AWS, Linux, and big data environments (Hadoop and Spark)
Ability to work in a big data environment
Creative thinking and able to work in a dynamic and fast paced environment
Strong stakeholder management and interpersonal skills
Reaching out
For a confidential discussion on this or any other opportunities available in the market please contact KarMun Cheah at karmun.cheah@next-wavepartners.com - Direct Line: +65 6692 9042
EA License No: 16S8303 - EA Registration No: R1877984"
"AI Chief Data Scientist","17MEDIA SG PTE. LTD.",Singapore,"$10,000 - $20,000 a month","We’re seeking an experienced data scientist to deliver that insight to us on a daily basis.
Analyze data for trends and patterns, and Interpret data with a…","Roles & Responsibilities
At 17 Media SG, we rely on powerfully insightful data to power our systems and solutions. We’re seeking an experienced data scientist to deliver that insight to us on a daily basis. Our ideal team member will have the mathematical and statistical expertise you’d expect, but a natural curiosity and creative mind that’s not so easy to find. As you mine, interpret, and clean our data, we will rely on you to ask questions, connect the dots, and uncover opportunities that lie hidden within—all with the ultimate goal of realizing the data’s full potential. You will join a team of data specialists, but will “slice and dice” data using your own methods, creating new visions for the future.

Objectives of this Role
Collaborate with product design and engineering to develop an understanding of needs
Research and devise innovative statistical models for data analysis
Communicate findings to all stakeholders
Enable smarter business processes—and implement analytics for meaningful insights
Keep current with technical and industry developments
Daily and Monthly Responsibilities
Work as the lead data strategist, identifying and integrating new datasets that can be leveraged through our product capabilities and work closely with the engineering team to strategize and execute the development of data products
Execute analytical experiments methodically to help solve various problems and make a true impact across various domains and industries
Identify relevant data sources and sets to mine for client business needs, and collect large structured and unstructured datasets and variables
Devise and utilize algorithms and models to mine big data stores, perform data and error analysis to improve models, and clean and validate data for uniformity and accuracy
Analyze data for trends and patterns, and Interpret data with a clear objective in mind
Implement analytical models into production by collaborating with software developers and machine learning engineers.
Communicate analytic solutions to stakeholders and implement improvements as needed to operational systems
Skills and Qualifications
Bachelor’s degree in statistics, applied mathematics, or related discipline
8+ years experience in data science
Proficiency with data mining, mathematics, and statistical analysis
Advanced pattern recognition and predictive modeling experience
Experience with Excel, PowerPoint, Tableau, SQL, and programming languages (i.e., Java/Python, SAS)
Comfort working in a dynamic, research-oriented group with several ongoing concurrent projects
Preferred Qualifications
Master’s degree in stats, applied math, or related discipline
5+ years of project management experience
Professional certifications [CANDIDATES WHO REQUIRE WORK PASSES NEED NOT APPLY]

[CANDIDATES WHO REQUIRE WORK PASSES NEED NOT APPLY]"
"Junior Scientist","PRESTIGE BIOPHARMA PTE. LTD.",Singapore,"$3,000 - $4,000 a month","Assist in management and supervision of day to day laboratory operations and personnel including lab maintenance and monitoring, and study data recording,…","Roles & Responsibilities
Job Description & Requirements
Conduct studies under non GLP (Good Laboratory Practice) system compliant with US FDA and OECD GLP principles, including bio analytical.
Analytical and bio analytical studies and other investigations.
Manage work areas to ensure scientific integrity of studies conducted in such areas.
Supervise and train study personnel including technicians, junior research staff and interns on study/laboratory techniques and proper use of equipment.
Understand study background, objectives, design and criteria, and have full understanding of/familiarity with investigational drugs or medical devices to conduct studies in a high scientific quality and to train and guide study staff, interns and technicians.
Assist in management and supervision of day to day laboratory operations and personnel including lab maintenance and monitoring, and study data recording, report and SOPs writing.
Assist in preparation and coordination of regulatory inspections and guests visits/inspections.
Any additional duties as directed by Head of Research and Development. [CANDIDATES WHO REQUIRE WORK PASSES NEED NOT APPLY]

[CANDIDATES WHO REQUIRE WORK PASSES NEED NOT APPLY]"
"Data Scientist","POINT72 ASIA (SINGAPORE) PTE. LTD.",Singapore,"$7,000 - $13,000 a month","2+ years of experience as a Data Scientist, quantitative researcher or in a similar role.
Identification of new data sets.
Programming skills in Python or C++.","Roles & Responsibilities
Identification of new data sets
Engaging with vendors to understand characteristics of datasets
Building processes and technology tools to ingest, tag and clean datasets
Analysis of datasets to generate descriptive statistics and propose potential applications of data
Research of potential “alpha signals” for presentation to Portfolio Managers
Monitoring and enhancing the automated data collection and cleansing infrastructure
Research on new technologies for improved data management and efficient retrieval
Ph.D. in computer science, mathematics, physics, statistics or another disciplines involving rigorous quantitative analysis techniques
2+ years of experience as a Data Scientist, quantitative researcher or in a similar role
Experience working with large data sets, including classification, regression, distribution analysis, and predictive modeling
Experience applying statistical tests to large data sets
Programming skills in Python or C++
Strong problem solving skills
High level of attention to detail a must
Strong oral and written communication skills
Ability to work both independently and collaboratively within a team [CANDIDATES WHO REQUIRE WORK PASSES NEED NOT APPLY]

[CANDIDATES WHO REQUIRE WORK PASSES NEED NOT APPLY]"
"Data Scientist","Comtel Solutions Pte Ltd",Singapore,None,"Interpret data and analyses data with SQL, R, Octave, Python.
Develop data model that are meaningful and impactful on a critical market data application.","Develop data model that are meaningful and impactful on a critical market data application
Develop data model that are meaningful and impactful on a critical market data application.
Interpret data and analyses data with SQL, R, Octave, Python.
Build up analytic dashboard with QlikSense, Power BI, R Shinny.
Strong hands-on experience in Python, R, or Octave
Good knowledge in mathematic modelling, statistics, probabilities.
Understanding on Machine Learning technics, Neural Network, Linear regression, sentiment analysis, Clustering, anomaly detection, NLP, chatbot, Topic Modelling, Entity Recognition.
Experience in UI presentation, QlikSense, Power BI, R Shiny, orD3.js
Strong knowledge in SQL (Oracle, MySQL, MariaDB)
Familiar with Linux operation system"
"Data Engineer / Data Analyst","GMP RECRUITMENT SERVICES S PTE LTD",Singapore,"$7,000 - $8,000 a month","Create data tools for analytics and data scientist team members that assist them in building and optimizing our product into an innovative industry leader.",None
"Speech / Voice Scientist (Data Science)",Sentient.io,"Buona Vista","$7,500 - $11,000 a month","Source for different types of available data sets and combine them with company available data to create commercially valuable IP.",None
"Data Scientist","JobStudio Pte Ltd",Singapore,"$5,500 - $9,500 a month","Our client – an Internet company is searching for Data Scientist As a Data Scientist, you will apply your strategic and analytical skills to major company…",None
"Data Scientist - Singapore",Accenture,Singapore,None,"As well as be exposed to the challenges of using statistics in a business setting, such as incomplete data, biased data, large data sets, low signal-to-noise…",None
"Data Scientist",Dyson,Singapore,None,"You will also team up with Data Engineers to get advice and support on accessing data.
Experience in data cleaning and blending multiple data sources …",None
"Data Scientist","Hewlett Packard Enterprise",Singapore,None,"We have an exciting opportunity for a Data Scientist to join our team and make a difference!
HPE APJ Innovation Center Singapore focuses on providing customers…",None
""Data Scientist" "NLP" ,"Machine Learning"",Confidential,Singapore,None,"Â€¢A Bachelorâ€™s degree in Data Scientist or Computer Science (or equivalent experience).
Â€¢5 â€“ 10 years of data analytics exposure.",None
"AI Data Scientist","17MEDIA SG PTE. LTD.",Singapore,"$6,000 - $10,000 a month","We’re seeking an experienced data scientist to deliver that insight to us on a daily basis.
Analyze data for trends and patterns, and Interpret data with a…",None
"Data Scientist","OVERSEA-CHINESE BANKING CORPORATION LIMITED",Singapore,"$4,000 - $10,000 a month","Conduct data exploration, feature engineering, visualization and develop models.
Clear communicator, with the ability to articulate ideas with data.",None
"Data Scientist","PALO IT SINGAPORE PTE. LTD.",Singapore,"$5,000 - $7,500 a month","Data-oriented background in SQL, data wrangling and data modelling.
The Data Scientist will design, build and execute machine learning techniques on large,…",None
"Chief Data Scientist","NextWave Partners",Singapore,None,"We are looking for a Chief Data Scientist who will be leading and driving the direction of advanced analytics strategy and implementation.",None
"Data Scientist","XYPHER PTE. LTD.",Singapore,"$4,000 - $5,000 a month","As our Data Scientist, you will.
As a Data Scientist at DATAVLT, you will be reporting to the Head of Data Scientist and Software Engineers who are focused on…",None
"Data Scientist","Comtel Solutions Pte Ltd",Singapore,None,"Interpret data and analyses data with SQL, R, Octave, Python.
Develop data model that are meaningful and impactful on a critical market data application.",None
"Machine Learning Engineer","JobStudio Pte Ltd",Singapore,None,"You will be working closely with senior data scientists to deliver proprietary algorithms running at scale across our data platform Writing modular, scalable…",None
"College Intern - Data Science",HP,Singapore,None,"Knowledge of data science, data warehousing, database management (preferably using SQL) and data visualization using RShiny/Plotly.","HP is a proven leader in personal systems and printing, delivering innovations that empower people to create, interact, and inspire like never before. We leverage our strong financial position to extend our leadership in traditional markets and invest in exciting new technologies.

HP has an impressive portfolio and strong innovation pipeline across areas such as:
blended reality technology - our unique Sprout by HP will change the way people do things
3D printing
multi-function printing
Ink in the office
tablets, phablets, notebooks
mobile workstations
We are looking for visionaries who are ready to make an impact on the way the world works. At HP, the future’s yours to create! If you are our College Intern in Singapore, you will be attached to the "Smart Manufacturing Application and Research Center" and will have a chance to:
Work with an enterprising team of data scientists and build solutions to track, analyze and visualize outgoing quality of our supplies
Create algorithms to extract information from large data sets.
Generate deep insights through the analysis of data and understanding of operational processes and turn them into actionable recommendations
Develop methodologies for optimizing our business processes through data visualization, real-time monitoring, predictive analytics etc.
Establish scalable, efficient, automated processes for model development, model validation, model implementation and large-scale data analysis
Are you a high-performer? We are looking for an individual with:
Studying Master’s degree in Computer Science, Business Analytics, Information Systems, Industrial Engineering, Statistics with good experience in programming
Excellent analytical thinking, programming (using R/Python is desirable), and problem-solving skills
Knowledge of data science, data warehousing, database management (preferably using SQL) and data visualization using RShiny/Plotly
Fundamental knowledge of statistics and probability
Familiarity with predictive modeling, machine learning, and optimization algorithms
Ability to communicate ideas clearly and coherently in a convincing manner"
"Data Scientist - Geographic / Logistic Optimisation",Shopee,Singapore,None,"Extract data insights from massive data sets, and build data visualisation for business and technical audiences.","Job Description

Work cross-functionally with business owners/product managers/engineers, and designers throughout the whole process of the data science projects
Develop, deploy, and maintain scalable infrastructure for AI models and algorithms. The domain includes but not limited to Logistics and Supply Chain Management, Natural Language Processing, Large-scale Scheduling and Optimisation, Geographic Solution and Maps.
Extract data insights from massive data sets, and build data visualisation for business and technical audiences. Communicate solution approaches to work with partners and stakeholders efficiently
Design and conduct data science experimental framework to enable organization-wide data-driven practice
Requirements:
Masters or PhD in Computer Science, Operations Research, Mathematics, Statistics or fields related to data mining preferred with minimum 2 years working experience in relevant industry
Excellent communication skills with the ability to identify and communicate data-driven insights and solutions
Deep understanding in algorithmic foundations of optimization, NLP, statistics and probability
Experienced in at least one programming language (e.g., Golang, C++, Java, Python) and Unix/Linux system
Preferred Qualifications:
Having one or more of the following skills will be a big plus.

Practical experience in logistics and map relevant industry (POI, map matching, geocoding etc.)
Practical development experience in real-time large-scale optimisation algorithms (e.g., supply chain network optimisation, vehicle optimisation optimisation)
Practical experience in Kubernetes/Docker"
"Data Scientist",percept-solutions,Singapore,"$6,000 - $9,000 a month","Experience with Data Mining, Statistical Modelling, and Data Manipulation.
Implement solutions to problems using data mining, data analysis, and optimization…","Job Description
Apply advanced data science and machine learning techniques to develop commercially driven products
Work on full life-cycle product development
Implement solutions to problems using data mining, data analysis, and optimization tools
Job Requirements
Experience with one or more of the following platforms SAS, SPSS, Python, R, Hadoop or SQL
Proven Java or Python development skills are a must
Experience building predictive models and implementing them in a production environment is preferred
Strong analytical and problem-solving skills
Experience with Data Mining, Statistical Modelling, and Data Manipulation
Advanced statistical analysis (predictive models and segmentation)
Proficient in QlikSense or Tableau
EA License No: 18S9405 Reg No: R1330864
Skills & Competencies
Data Analysis, Statistical modelling, Predictive Analysis
Number of Vacancies:
4
Minimum Years of Experience:
3
Salary:
S$6000-S$9000"
"Data Scientist, Singapore",Axinan,Singapore,None,"Work with backend engineers to architect data storage and processing pipelines.
Work with product managers to develop new product features based on insights…","What will you do?

Design and build data driven systems for risk control, fraud detection, recommendation, customer segmentation, adaptive pricing etc.

Build, validate, test, and deploy models and algorithms.

Work with backend engineers to architect data storage and processing pipelines.

Work with product managers to develop new product features based on insights from data.

What do you need?

Master or PhD in computer science, statistics, mathematics, or fields related to big data preferred.

Experience in Python or R.

Knowledge in supervised/unsupervised learning, classification/clustering algorithms, feature engineering/optimization, computer vision.

Experience in deep learning, reinforcement learning, personalized search and recommendation, user/seller behavior modeling, marketing algorithms preferred.

Experience of Hadoop, Spark, Tensorflow is a plus.

Experience with visualization software to convert models/insights into simple, business sell-in stories would be an advantage (but not mandatory).

Outstanding analytical and problem-solving skills.

Self-motivated, innovative, and proactive. Willing to learn new knowledge and explore unfamiliar domains."
"Data Scientist - AI Lab","OCBC Bank",Singapore,None,"Strong interest in data, machine learning and artificial intelligence.
Clear communicator, with the ability to articulate ideas with data.","Job description:
Develop data-driven web applications using Python and JavaScript.
Contribute to scaling our data science capability through the development of smart apps.
Be a thought-leader and drive innovation within the organisation.


LI-VN

Qualifications

Requirements:
Degree in a quantitative subject (e.g. Computer Science, Engineering, Mathematics, or related field).
Minimum 5 years of working experience developing web applications.
Strong proficiency in Python and JavaScript.
Proficiency using Python-based web frameworks such as Flask, Django or Dash would be a strong advantage.
Strong interest in data, machine learning and artificial intelligence.
Exposure to React.js and related frameworks.
Experience using Docker and Kubernetes or similar frameworks to deploy web applications at scale.
Clear communicator, with the ability to articulate ideas with data.
Experience with operating in a corporate environment and stakeholder management.
Strong results driven personality with an innovative spirit

Primary Location: Singapore
Job: Analytics
Organization: Group Customer Analytics and Decisioning
Schedule: Permanent
: Full-time
Job Posting: 12-Mar-2020, 4:05:38 AM"
"Research Scientist","Singapore Management University",Singapore,None,"Required to design research methodologies and develop algorithms and models Required to design and conduct experiments, as well as implement applications, tools…","Work in the area of Artificial Intelligence, Deep Learning and Machine Learning in the Application domain of Smart Consumption and Healthy Lifestyle, which aims to aid citizens to understand demographics and adopt a healthy lifestyle. Required to design research methodologies and develop algorithms and models Required to design and conduct experiments, as well as implement applications, tools and systems Assist to develop analytics capabilities in big data infrastructure and conduct data science studies Qualifications PhD in Computer Science or related disciplines Good knowledge in relevant research topics and related research skills Proficient in at least one or more of these programming languages: Java, Python, C#, C++ and C Self-motivated and able to carry out tasks independently Excellent team player and possess strong inter-personal skills Analytical and meticulous with attention to details"
