title,companyname,location,salary,summary,description
"Associate Test Engineer (eBeam)",KLA-Tencor,Singapore,None,"These technologies serve the semiconductor, data storage, LED, and other related nanoelectronics industries.
With a portfolio of industry-standard products and…","Job Opening ID: 122601
Singapore, Singapore
Full-Time
Regular

Company Overview
KLA Corporation, a leading provider of process control and yield management solutions, partners with customers around the world to develop state-of-the-art inspection and metrology technologies. These technologies serve the semiconductor, data storage, LED, and other related nanoelectronics industries. With a portfolio of industry-standard products and a team of world-class engineers and scientists, the company has created superior solutions for its customers for more than 35 years. Headquartered in Milpitas, Calif., KLA has dedicated customer operations and service centers around the world. Additional information may be found at
www.kla-tencor.com
.
Group/Division
KLA has manufacturing sites across the globe, including Belgium, China, Germany, Israel, Singapore and Milpitas (CA). The Global Operations (GOPS) team, comprised of Manufacturing, Supply Chain Management, Manufacturing Engineering, Installation, and Quality, is responsible for manufacturing our leading-edge technology. We partner with our world-wide supply base and our design engineering teams to bring new products to market. The GOPS team is continuously working to build our products Better, Faster, Cheaper.
Responsibilities
Performs the set-up, calibration, testing and troubleshooting of circuits, components, instruments and assemblies of eBeam tool
Determines and may develop test specifications, methods and procedures from blueprints, drawings and diagrams.
Tests and troubleshoots assemblies and/or final systems. May complete rework on assemblies and/or systems as a result of testing.
Prepares technical reports summarizing findings and recommending solutions to technical problems.
Assist in the selection and set-up of specialized test equipment.
Installation/field support may be expected
Qualifications
Bachelor Degree or Diploma in Engineering. Degree in Electronics will be advantageous.
Ability to read technical drawings/procedures and use a variety of precision testing and measuring instruments.
Previous hands-on experience with semiconductor equipment
Strong troubleshooting and analytical skills to resolve technical problems, set up experiments, and perform data analysis.
Excellent communication, teamwork, and people skills are required.
Comfortable working in shifts and clean room environment"
"Research Fellow/Research Associate, MERSU","Nanyang Technological University",Novena,None,"Experience in psychometric analysis of assessment data.
In addition, the appointee will assist preparing research materials, protocols, and will be involved in…","Post-Doctoral Research Fellow position OR Research Associate for Team-Based Learning (TBL) research in medical education
The Lee Kong Chian School of Medicine (LKCMedicine) uses Team-Based Learning (TBL) as its core pedagogical approach. In short, TBL is student-centred and facilitated by educators, clinicians and scientists. Students work in small teams and start by individually preparing for their session (preparation phase). Once in class, students take both individual and team quizzes to test their understanding of the topic (readiness assurance phase). Lastly, students get the opportunity to apply and test their newly gained understanding by answering a series of Application Exercise (AE) questions (application phase). Teams discuss each AE and discuss their findings with the class.
We are looking for a Post-Doctoral Research Fellow Or Research Associate who has experience with research in active-learning environments, such as TBL or Problem-Based Learning, and who can make a significant contribution to our research programme (note: a background in medical education is not necessarily required).
Responsibilities
Research Fellow:
The primary role of the Post-Doctoral Research Fellow is conducting research on TBL in collaboration with the members of the medical education research team. The main objective of the role is to contribute to the TBL research programme by publishing research findings in high-impact journals.
Research Associate:
The primary role of the Research Associate will be working closely with members of the TBL research team to ensure that all administrative matters are taken care of. In addition, the appointee will assist preparing research materials, protocols, and will be involved in data collection, data analysis, and reporting.
Requirements
Research Fellow:
He or she must have a strong background in research methodology and statistical data analysis;
The candidate must have a publication as first author in a top-tier educational research journal.
The candidate must have a PhD in psychology or education
Research Associate:
Necessary:
Background in education or psychology
Strong background in research methodology and statistical data analysis
Master’s degree in psychology or education
Desirable:
Experience in educational research
Experience in project management
Experience in online data collection techniques (e.g., Qualtrics)
Experience in psychometric analysis of assessment data
Hiring Institution: LKC"
"Research Associate","Nanyang Technological University",Singapore,None,"Time series data analysis, signal enhancement and feature extraction, auto feature engineering tools, big data processing, machine learning algorithms, neural…","Rolls-Royce@NTU Corporate Lab is looking for a Research Associate to work in our project on Artificial Intelligence for smart discovery, a sub-project under Data Analytics and Complex Systems. The project aims to provide data analytics users (e.g. data scientists, subject matter experts, laymen, etc..) with tools and processes to examine large datasets and overcome tedious and time-consuming processes such as: Signal enhancement, feature generation and visualization; Knowledge representation and real time analysis.
This project will have the following key deliverables:
Baseline prototype development for feature engineering
Enhancement on baseline system for smart discovery
Demonstration of final prototype of knowledge discovery and layman analytics capability
Development of novel algorithms and IPs related to the project scope
Responsibilities
Conduct in-depth research on time-series data to examine various features associated with rare events detection, automatic identification of important parameters, weak signal detection and enhancement and unsupervised clustering of time series data
Prototype development for feature engineering and enhancement on baseline systems for smart discovery
Explore novel machine learning based algorithms to automate and speed up feature engineering for time series data
Requirements
A good Master degree holder with sufficient research experience in one of the following areas: Data Analytics, Machine Learning, AI or related fields
Good experiences in one or more of the following areas: time series data analysis, signal enhancement and feature extraction, auto feature engineering tools, big data processing, machine learning algorithms, neural networks
Excellent programming skills in PYTHON, R, MATLAB, C/C++, etc.
Excellent analytical, technical and problem-solving skills
Good publication record in reputable journals and/or conferences
A team player with good people skills, innovative, resourceful and self-motivated.
Strong verbal and written communication skills.
The successful candidate will receive a competitive remuneration package commensurate with their qualifications and experience.
Please note that only successful candidates would be notified.
Hiring Institution: NTU"
"Front End Engineer",Refinitiv,Singapore,None,"Networking in the fintech, big data and academic community through conferences, meetups and workshops – bringing cutting edge techniques and technology into…","Job Summary
Refinitiv Labs provides a unique opportunity to work in a global company with a culture of a startup. As a part of our growing Singapore Lab team of data scientists, engineers and UX/UI designers you will be part of our global network of like-minded colleagues in our sister labs in London and New York
We are looking for a Frontend Engineer capable of producing scalable software solutions. You will be part of a cross-functional team that’s responsible for the full software development life cycle, from conception to development.
You should have strong experience with front-end coding languages, development frameworks, and third-party libraries. You should also be familiar with visual design and be willing to work with a team.
Responsibilities
Building spectacular Proof of Concepts (POCs) to Beta products for the global Finance and Risk community via design led agile development in partnership with customers
Creating compelling proposals with technologists in partnership with business, driving innovation from conception to production
Analysis, design and implementation of complex software solutions using customer focused design driven methodologies, delivered via public cloud
Defining, organising and implementing projects across multiple locations and time zones
Translating end user needs to requirements using a lightweight agile design led methodology
Building domain expertise in Financial market content and Refinitiv systems.
Networking in the fintech, big data and academic community through conferences, meetups and workshops – bringing cutting edge techniques and technology into business strategy
Required Skills
Excellent skills and experience working with front-end JavaScript.
Strong experience with front-end frameworks and libraries, preferably React, Vue or Angular.
Familiarity with web servers, databases and cloud-based services, preferably AWS.
Strong UI/UX design exposure and experience in making apps work intuitively
Critical thinking, value judgment and common sense over process.
Able to work independently as well as in a team.
Positive attitude to learning new skills and technologies.
Diploma / Degree in Information Technology / Computer Science / or equivalent
Job Type: Contract
Experience:
React, Vue or Angular, AWS: 1 year (Preferred)
Front end development: 1 year (Required)"
"Research Fellow (Flood Risk Analysis)","Nanyang Technological University",Singapore,None,"Conceive, design, prototype and implement solutions to collect and analyze complex data on flood hazard and its impacts on the built environment.","The Disaster Analytics for Society Lab at Asian School of the Environment, Nanyang Technological University (NTU) in Singapore is looking for an exceptional candidate for a postdoctoral position in the field of disaster risk with a particular focus on Flood Risk Analysis. The lab aims to rapidly deploy and produce valuable, actionable research in pre- and post-disaster contexts in Southeast Asia to inform both risk reduction and recovery efforts. The ideal candidate will combine strong technical expertise with a passion for humanitarian and disaster-related research.
Duties and Responsibilities
Conceive, design, prototype and implement solutions to collect and analyze complex data on flood hazard and its impacts on the built environment
Support the testing and implementation of machine learning algorithms and their integration within the flood risk analysis framework
Analyze flood adaptation measures for coastal and riverine flooding for select cities in South-East Asia
Develop flood damage models appropriate for select case-study cities
Supervise and mentor junior colleagues, as needed
Requirements
PhD degree in quantitative earth, environmental system or environmental engineering sciences or related fields
Experience with developing flood damage models
Experience with flood modeling tools and state-of-the-art software, especially the Deltares flood modeling suite
Experience with machine learning and its application for flood risk modelling
Demonstrated ability to publish high-quality research
Self-driven, highly motivated, collaborative, with interest to work with other researchers and scientists (team player) to produce high-quality and impactful research
Interest in the field of natural hazards and reducing their impacts on society
Excellent oral and written communication skills in English
Interested applicants are invited to submit a full CV, work samples and names and contact details of two referees.
Enquiries can be sent to Ms. Sanjana Tadepalli (sanjana.tadepalli@ntu.edu.sg).
We regret only shortlisted candidates will be notified.
Hiring Institution: NTU"
"Senior Data Control Specialist","Robert Walters",Singapore,None,"Experience with structured and unstructured data design/modelling, data access, security and data storage techniques.
Apply now to learn more.","An exciting Senior Data Control Specialist job has become available at a global leading telecommunications firm with a superb brand and reputation.
About the Senior Data Control Specialist Role:
Reporting to the Director of Data Management, you will establish, develop, expand and optimise data control architecture, design and implementation.
Key Responsibilities:
Design, develop and implement data security, privacy, protection and associated control technology solutions (big data) as per best industry practices
Evaluate and renew implemented data security, privacy, overall data control solutions to ensure their relevance and effectiveness in supporting business needs and regulatory requirement (PDPA, GDPR, Telecom act, etc.)
Drive the development, optimisation, testing and tooling to improve overall data control management (security, consent management, privacy, protection)
Review, analyse, benchmark and approve solution design from product companies, internal teams and vendors
Ensure that proposed solutions are aligned and conformed to the data landscape, big data architecture guidelines and road map
Design and implement data security, privacy, protection framework and optimised service and access management
Understand business requirements and solutions design to develop and implement solutions that adhere to big data architectural guidelines, address regulatory and compliance requirements
Design, develop and maintain data security and privacy framework, policy, solution and systems
Design, develop and maintain data protection and consent management systems
Drive BAU process, testing and tooling to improve data security, privacy and protection
Identify, design, and implement internal process improvements: automating manual processes, control and optimising data technology service delivery
Build a robust and scalable data infrastructure to support needs from internal and external users, regulators and compliance requirements
Review and approve high level and detailed design to ensure that the solution delivers to the business needs and align to the data landscape and analytics, architecture principles and road map
Understand the latest data security standards and tools to apply and adhere to the required data controls for user access in Cloudera/Hadoop, Oracle and other DB platform and overall data environments and projects
Support and contribute to development guidelines and standards for data security, privacy with risk, compliance, regulatory functions
Work with infrastructure, operations, data scientists and business analytics team to assist in data related technical issues and implement effective solutions
Key Requirements:
Bachelor’s degree in IT, computer science, software engineering, data/business analytics or equivalent
Data management, security, privacy, protection-related qualification/certification (e.g. DAMA, Symantec CSP in Data Protection, Certified McAfee Security Specialis or Expert, or RSA Certified McAfee Security Specialist CMSS - DLP Focus, Websense Data Security Suite (DSS) Professional)
10 - 12 years of experience in data warehousing/big data/Hadoop /RDBMS – Security, Privacy, Protection technologies and tools
Expert in building data management solutions - data security, privacy solutions, architectures and implementation
Ability to troubleshoot and issue resolution complex security, privacy requirements
Experience with structured and unstructured data design/modelling, data access, security and data storage techniques
Experience with relational SQL and NOSQL DB
Experience with cost estimation based on the design and development
Experience with Agile, DevOps tools and environment
Experience in Telco data warehouse and/or Data Lake
Experience in multiple (end to end) data security, privacy, protection implementations and operationalisation
Knowledge of AI, ML, NLP (R/Python), data analytics
Experience in ETL and/or data wrangling tools for big data environment – Informatica Big Data Management, Informatica PowerCenter,Talend, Trifacta, etc.
Python/Scala/Java, HIVE/HBase/Impala/Parquet, Sqoop, Kafka, Flume, Jenkins/Docker
Data virtualisation – Denodo, AtScale, etc.
Visualisations – Tableau, PowerBI
Hadoop/big data platform and its components knowledge and experience
Informatica data management tools (EDC, AXON, Secure@source, IDQ, BDQ), IBM Guardium Data Protection or equivalent
Data encryption, security management techniques and methodology
Data masking –Informatica Suite, Protegrity, Oracle/Teradata Dynamic Masking or equivalent
Data management tech stack – AWS KMS, thales, etc.
Microservices – API, good to have API management tool experience – Mulesoft, Apigee, etc.
This is a fantastic company to work for with a great culture, excellent rewards and progression.
We are looking for someone highly organised, self-motivated, proactive, and able to plan. Great career progression awaits the right person in this Senior Data Control Specialist role.
Apply now to learn more.
Robert Walters (Singapore) Pte Ltd
ROC No.: 199706961E | EA Licence No.: 03C5451
EA Registration No.: R1654295 Jay Teo

An exciting Senior Data Control Specialist job has become available at a global leading telecommunications firm with a superb brand and reputation."
"Research Fellow (Disaster Risk Reduction)","Nanyang Technological University",Singapore,None,"Experience working with spatial data.
Conceive, design, prototype and implement solutions to collect and analyze complex data on natural hazards and their…","The Disaster Analytics for Society Lab at Asian School of the Environment, Nanyang Technological University (NTU) in Singapore is looking for an exceptional candidate for a postdoctoral position in the field of disaster risk reduction. The lab aims to rapidly deploy and produce valuable, actionable research in pre- and post-disaster contexts in Southeast Asia to inform both risk reduction and recovery efforts. The ideal candidate will combine strong technical expertise with a passion for humanitarian and disaster-related research.
Duties and Responsibilities
Conceive, design, prototype and implement solutions to collect and analyze complex data on natural hazards and their impacts on society
Support in planning, coordinating and execution of field activities for the Disaster Analytics for Society Lab (DASL), leading to the successful execution and coordination of disaster-related fieldwork
Support the development of the spatial analysis lab (hardware, software and capacity-building)
Conduct spatial analysis work in support of various research projects on disaster risk and recovery
Willing to travel frequently, occasionally for extended periods (up to 2-3 weeks)
Requirements
PhD degree in quantitative earth or environmental system sciences, civil / environmental engineering, computer science or related fields
Self-driven, highly motivated, collaborative, with interest to work with other researchers and scientists (team player) to produce high-quality and impactful research
Experience with field research
Experience working with spatial data
Demonstrated ability to publish high-quality research
Interest in the field of natural hazards and reducing their impacts on society
Excellent oral and written communication skills in English
Interested applicants are invited to submit a full CV, work samples and names and contact details of two referees.
Enquiries can be sent to Ms. Sanjana Tadepalli (sanjana.tadepalli@ntu.edu.sg).
We regret only shortlisted candidates will be notified.
Hiring Institution: NTU"
"Senior UX Researcher","Titansoft Pte Ltd","Central Singapore",None,"A good understanding of data and statistics.
You collect, test, analyse and interpret data to improve the product.
You know what users want.","About us
You read minds. You know what users want. You are able to sell your ideas to Product Owners that is well supported by data and research.
You are more than just a mind reader looking into crystal balls. Armed with the tools of your trade - Google Analytics, usability and A/B testing tools, you gather insights from hard facts to back up your talk.
You are not just any other UX Researcher. You collect, test, analyse and interpret data to improve the product. You are continuously learning, constantly improving and if that resonates with you, you are then the senior UX Researcher we want in Titansoft.

Job Description
What a Senior UX Researcher does in Titansoft
Understand and incorporate complex technical and business requirements into research protocol
Lead independent research to uncover usability issues and take charge of measuring and monitoring UX metrics of products
Co-work with Product Owners, Software developers, Data Scientists and the UX team to identify opportunities and bring about product growth
Strategize and plan for product growth by using a combination of qualitative and quantitative research to inform decisions and validate assumptions
Use storytelling as a way to effectively communicate research findings and insights to diverse stakeholders
Be a contributing member of the team by actively mentoring and coaching team members

Job Requirements
What we are looking for in a Senior UX Researcher
Qualification
Degree in Computer Science, Communications and Design, Psychology, Information Science and related, or equivalent practical experience
Experience
3-5 years of relevant work experience in a UX role
Experience in integrating user research into product design and design practices in an agile environment
Experience in leading research projects from start to end
Skills
Strong interpersonal communication skills to be able to co-work with different teams and provide insights to stakeholders
Ability to process information in a logical and rational manner
Ability to determine and recommend suitable research methodology for each user research project such as but not limited to User interviews, usability testing, A/B testing, surveys, card sort.
Well-versed with Google Analytics (GA), Google Tag Manager and A/B testing tools (VWO/ Inspectlet)
A good understanding of data and statistics
What makes a (super!) Senior UX Researcher in Titansoft
Hands-on experience in recruitment, scheduling and logistics planning for qualitative research

Job Reference: TITANSOFT00081"
