title,companyname,location,salary,summary,description
"Data Analyst","SMARTKARMA INNOVATIONS PTE. LTD.",Changi,"$4,000 - $6,000 a month","Acquire data from primary or secondary data sources and maintain databases/data systems.
Technical expertise regarding data models, database design development,…","Roles & Responsibilities
We seek a passionate Data Analyst to turn data into information, information into insight and insight into business decisions. Your responsibilities include conducting full lifecycle analysis to include requirements, activities and design. You will develop analysis and reporting capabilities. You will also monitor performance and quality control plans to identify improvements.

Job Responsibilities
Interpret data, analyze results using statistical techniques and provide ongoing reports
Develop and implement databases, data collection systems, data analytics and other strategies that optimize statistical efficiency and quality
Acquire data from primary or secondary data sources and maintain databases/data systems
Identify, analyze, and interpret trends or patterns in complex data sets
Create “cleaned”, standardized data-sets, and implement data standardization processes
Work with management to prioritize business and information needs
Locate and define new process improvement opportunities
Requirements
At least 2 years working experience as a data analyst or business data analyst
Technical expertise regarding data models, database design development, data mining and segmentation techniques
Strong knowledge of and experience with reporting packages (Business Objects etc), databases (SQL etc), programming (XML, Javascript, or ETL frameworks)
Knowledge of statistics and experience using statistical packages for analyzing datasets (Excel, SPSS, SAS etc)
Strong analytical skills with the ability to collect, organize, analyze, and disseminate significant amounts of information with attention to detail and accuracy
Adept at queries, report writing and presenting findings
BS in Mathematics, Economics, Computer Science, Information Management or Statistics
What You Will Get in Return
This is a very exciting role as you will have the opportunity to learn about many aspects of the fintech industry. You will work with a team of motivated, high-quality professionals who will challenge you and mentor you along the way. Benefits include generous leave and health insurance plans, along with a work environment where employees are evaluated on the quality of their work and not solely on the hours they put in.
About Smartkarma
Smartkarma (https://www.smartkarma.com/) is a unique, independent financial research platform that is radically changing the way capital market participants create, distribute and consume investment research.
We combine intelligence from the world’s premier analysts, academics, data scientists and industry experts in one collaborative network to help investors improve efficiencies, enhance returns, and optimize their research spends while accessing the widest range of global analysis of the Asian markets.
Smartkarma is headquartered in Singapore with five global offices, and a highly-motivated team trying to positively change the world of investment research
Join a world class team, and take on big challenges! [CANDIDATES WHO REQUIRE WORK PASSES NEED NOT APPLY]

[CANDIDATES WHO REQUIRE WORK PASSES NEED NOT APPLY]"
"Senior Research Scientist","Singapore Management University",Singapore,None,"The candidate will also assist to develop analytics capabilities in big data infrastructure and conduct data science studies.","The Research Scientist will work with faculty researchers on one or more of the following research topics in the urban/social computing, smart cities and consumer business domains. Data and Text Mining Machine Learning Deep Learning Crowdsourcing Recommender Systems Social-Urban Sensing Big Data Infrastructure The candidate is required to design research methodologies and develop algorithms and models. He/she will also be required to design and conduct experiments, as well as implement applications, tools and systems. The candidate will also assist to develop analytics capabilities in big data infrastructure and conduct data science studies.

Qualifications Phd in Computer Science or related disciplines Good knowledge in relevant research topics and possess related research skills Proficient in at least one or more of these programming languages: Java, Python, C#, C++ and C Strong interest in the AI, Deep Learning and Machine Learning field is an added advantage Self-motivated and able to carry out tasks independently Excellent team player and possess strong inter-personal skills Analytical and meticulous with attention to details"
"Software Engineer II","Thermo Fisher Scientific",Singapore,None,"Experience with advanced data visualization techniques and bioinformatics.
Experience with medical science solutions that manage genomic or biomedical data.","How Will You Make an Impact?

At Thermo Fisher Scientific, we have an incredible mission: to enable our customers make the world healthier, cleaner and safer. Our responsibility in supporting this vision is to consistently strive to work together and enable our customers more effectively. We have the 4i Values – Integrity, Intensity, Innovation and Involvement that define the way we work together and with our customers. As we operate within the 4i framework, there are three areas that we believe could really lead to a breakthrough in the way we work together: Accountability. Innovation. Risk tolerance.
When you join us at Thermo Fisher Scientific, you’ll be part of a smart, driven team that shares your passion for exploration and discovery. With revenues of $20 billion and the largest investment in R&D in the industry, we give our people the resources and opportunities to make significant contributions to the world.

What will you do?

The Digital Engineering team is tasked with applying industry best practices to the design, development, and deployment world-class software products. We are looking to hire individuals with experience with software development and test engineering in clinical and research settings, and who can help us solve the next wave of technical challenges using the latest cloud-based, big-data, and rich analytics tool sets.

You should be versed and comfortable spanning the full development lifecycle, from requirements identification and prototyping, through design and implementation, to customer acceptance and delivery. You are especially passionate about crafting excellent software designs and participating in an Agile/SCRUM setting to meet and exceed customer expectations. You like the idea of partnering with scientists and bioinformaticians to create outstanding BioTechnology solutions. You welcome the challenge of working in a fast-paced, discovery-oriented environment and will be genuinely excited about the prospect of creatively exercising your problem solving skills on a continuous basis with an eye to ultimately improving the human condition.

Essential Functions:

A member of a team of highly skilled software developers, ensuring great execution of Agile/SCRUM processes and repeatable, predictable, and high-quality delivery of software solutions
Participate in and oversee the design and development of new software and/or extensive software revisions.
Work with the product owner to define technical requirements and priorities then create user-stories, designs, and development tasks to be delegated to the team. Focus on successful conclusion to sprints and releases.
A member of a team in cross-organizational development forums as well as customer requirements gathering and software validation and training sessions



How will you get here?

I. Education
BS/MS in Computer Science, Physics, Mathematics or equivalently technical disciplines.

II. Experience

4+ years of experience as a full stack developer in designing and building browser-based Java applications using modern languages and frameworks with hands-on knowledge of user interface frameworks such as Javascript (ES6+) / Typescript, NodeJS, AngularJS, REST API, HTML/CSS is required.
Other languages (C#, Python, etc.) will be added advantage.

III. Minimum Qualifications

Has working knowledge on designing / implementing loosely coupled services through microservices architecture
Has experience, instincts, and enthusiasm around testing and testability
Is authentic, transparent and holding self-accountable. Collaborates with others

IV. Preferred Qualifications (nice to have)

Experience with Amazon Web Services or other leading cloud deployment platforms and services
Experience or working knowledge of container technology (e.g Docker) and orchestration
Experience with building continuous integration / continuous delivery (CI/CD) pipelines
Experience with medical science solutions that manage genomic or biomedical data
Experience with advanced data visualization techniques and bioinformatics

V. Knowledge, Skills, Abilities
Experience working with geographically distributed team
A highly motivated fast learner who can self-start and “figure out what needs figuring out”
Excellent verbal and written communication skills. Ability to effectively document artifacts and processes then explain them to others"
"Data Scientist","Ellwood Consulting",Singapore,None,"Our client is looking for a PhD / Masters candidate to work with us to analyse the motion data, determine trends in the data and ultimately, create algorithms…","Our client is looking for a PhD / Masters candidate to work with us to analyse the motion data, determine trends in the data and ultimately, create algorithms to detect key events in the machine based on the live stream of sensor data.

Your responsibilities
Analyse the data to determine patterns for key events such as machine upward and downward acceleration, door open and close cycles, machine being stationary, machine travelling at constant speed and others.
Create algorithms to detect and display such events in real time.
Create algorithms to detect anomalies (which could mean machine failures) and determine what are the cause of those anomalies.
You will work closely with the team who are developing the platform, which provides workflow solutions and information access to stakeholders.

You will have
Ph.D. and Masters students majoring in Computer Science, Economics, Statistics, Machine Learning, Operations Research, or other quantitative disciplines.

Experience
Experience in modeling and algorithm development.
Coding proficiency and the ability to develop statistical analysis and prototype algorithms in Python or R.
Proficiency in SQL.
Ability to communicate effectively with both technical and business stakeholders."
"Data Scientist","NTT Limited",Singapore,None,"Extensive experience in data modelling.
Good experience with data warehouse and data lake technical architectures, infrastructure components, ETL/ ELT and…","Detailed information about the Job

Collaborate with business stakeholders to identify opportunities for leveraging data to drive business solutions
Research, design, implement, and deploy scalable data analytics vision and machine learning solutions to challenge complex business issues
Extending companyâ€™s data with third party sources of information when needed
Enhancing data collection procedures to include information that is relevant for building analytic systems
Processing, cleansing, and verifying the integrity of data used for analysis, and build algorithms necessary to find meaningful answers.
Preform analysis using programming languages or statistical packages such as Python and R etc.
Mine and analyse data to drive optimisation and improvement of business strategy
Architect scalable and highly available applications leveraging the latest tools and
Creatively visualize and effectively communicate results of data analysis, insights and ideas in a variety of formats to key decision makers within business
Take ideas to successful launch by leading and mentoring diverse, geo distributed teams through innovation, bootstrapping, pilot, production, scaling, and maintenance phases with multiple stakeholders to the highest levels of quality and performance
Develop SQL Queries for reports and dashboards
Analyse relational and transactional databases to provide data analysis, and presenting results in a clear manner
Create documentation around processes and procedures and manage code reviews
Apply industry standards best practices to development activities Other InformationÂ
Extensive experience with one or more programming languages (e.g. Python), statistical packages (e.g. R) and database languages (e.g. SQL)
Good experience with data warehouse and data lake technical architectures, infrastructure components, ETL/ ELT and reporting/analytic tools
Experience with common data science toolkits, such as R, Weka, NumPy, MatLab, etc. Excellence in at least one of these is highly desirable
Excellent understanding of machine learning techniques and algorithms, such as k-NN, Naive Bayes, SVM, Decision Forests, etc
Extensive experience in data modelling
Demonstrable experience applying statistical methods and machine learning techniques to solve business problems
Experience with distributed data/computing tools such as Map/Reduce, Hadoop, Hive, Spark, MySQL, etc.
Experience in working in micro-services architecture working with APIs development is preferred Experience in Elastic search, Scoring and recommendation on very large volumes of data
Experience with Agile Development Methodologies and Test-Driven Development is preferred

Extensive experience with one or more programming languages (e.g. Python), statistical packages (e.g. R) and database languages (e.g. SQL)"
"Research Scientist / Project Manager",Evonik,Singapore,None,"The Scientist position is critical to execute current and future projects in Smart Surface Solutions.
Additionally to lead a junior scientist and/or a team of…","Research Scientist / Project Manager

What we offer
You will work on exciting and challenging topics together with a team in an ultra-modern, innovative and creative environment. Intensive on-the-job training with expert colleagues guarantees you will quickly become familiar with your duties and perform them independently.
Click here to learn more about Evonik from our employees

The Scientist position is critical to execute current and future projects in Smart Surface Solutions. He/she will manage the project (from idea into a product development and subsequently launch of the product the production) with the support of the lab team.

RESPONSIBILITIES
Initiate & execute R&D projects in the area of Functional Coatings for Industrial application.
Innovate, develop, formulate and design new or improved functional coating for industrial application.
Ensure all necessary lab research activities can be carried out within the timeline of the projects and with good quality outcome
Develop his/her own idea to enhance the success of the project/program, initiate follow-up discussion. Keep up-to-date on the latest technology & business development in the area.
Plans experiments and activities based on established projects as well as new, exploratory ideas. Conduct literature searches associated with assigned projects.
Formulates, applies and characterizes material for functional coating experiments. Documents results and prepares technical reports with summaries and analysis for internal and external customers.
Develops new or revise tests, processes or procedures to support program or project goals.
Interface with various external partners including customers and thus is an important representative of Evonik R&D activities to the external collaborators.
For Senior Scientist: additionally to lead a junior scientist and/or a team of chemist/technician that will support the job

REQUIREMENTS
Masters or PhD in Chemistry, Polymer Science, Material Science or related subjects with minimum 3 years working experience in coatings-related area; specifically with projects/work experience related to coating formulation, application and testings; or
BSc candidates with >5 years relevant experience can also be considered.
Creative
Ability to set goals to work independently in conducting experiments, organizing data and analysis of the results.
Proven project management and project execution skills, with the ability to drive customer adoption of new technologies and existing products (Senior Scientist)
Strong laboratory technical skills, in particular coating formulation, application, testing and characterisation
Self-driving & self-motivating, initiate & drive projects/ideas independently. Highly motivated and enthusiastic entrepreneur spirit.
Comfortable to deal with high uncertainty & ambiguity. Not afraid to take a risk & willing to learn from failure
Collaborative team player, being able to be a team leader as well as team player. Take a leadership/coordination role on projects, especially those initiated by him/herself.
Excellent communication and interpersonal skills. Excellent language skill in English is essential and knowledge of basic German is advantageous.

Your Application
To ensure the fastest process of your application and to protect the environment, please apply online via our careers portal at https://careers.evonik.com.

Evonik Corporation is an equal opportunity employer. All qualified applicants will receive consideration for employment without regard to race, color, religion, age, gender, sexual orientation, national origin, disability status, protected veteran status or any other legally protected status.
Please note that Evonik will not accept any unsolicited application documents sent by staffing firms. Evonik works in conjunction with preferred service providers and will not pay any fee to staffing firms in the absence of an appropriate framework agreement. Should Evonik receive a candidate profile from a staffing firm with which it has no framework agreement, and should this candidate subsequently be considered in the recruitment process or offered employment, no claims from the staffing firm will be entertained in this regard."
"Data Scientist (Mgr/AM) with healthcare organisation (based...","The CAP Consulting",Singapore,None,"As a Data Scientist, you will perform the following:
Data Scientist (Mgr/AM) with an established healthcare organisation (based in town)*.
It is based in town.","Data Scientist (Mgr/AM) with an established healthcare organisation (based in town)
Min 4 years of relevant working experience in the data science field
Understand key concepts, techniques and considerations in machine learning and data analytics
Has relevant experience in Data science tools such as R, Python, and/or Visual analytics technologies like Tableau, Qlik
Our client is a Singapore not-for-profit organisation in the healthcare sector. It is based in town.
For this role, you are part of the Strategy Research and Data department. As a Data Scientist, you will perform the following:
Work with big volumes of data, converting them into actionable insights / models for both our users and team.
Work closely with stakeholders to understand their business challenges, scope the problem and develop business case on how to turn data into critical information and knowledge that are actionable and impactful,.
Perform data cleaning, pre-processing, feature engineering and build relevant models to conduct meaningful analysis. -Apply appropriate visualisation techniques to communicate the insight effectively. Iterate with the stakeholders to perform subsequent deep dives based on the initial insights.
Design of dashboards and interactive visualisations as tools for data exploration and storytelling may be expect
Key requiremetns:
Bachelor Degree in Computer Science, Statistics, Economics, Quantitative Social Science, or related degrees. Advanced degrees preferred.
Minimum 4 years of relevant working experience in the data science field
Ability to take a broad, strategic perspective as well as drill deep to understand business needs and challenges
Understand key concepts, techniques and considerations in machine learning and data analytics
Training and relevant experience in one or more of the following areas:
Data science tools such as R, Python
Visual analytics technologies like Tableau, Qlik
Excellent communication skills, both oral and written, with ability to pitch ideas and influence stakeholders
Strong analytical, conceptualisation and problem solving skills
Team player with strong organization and people handling skills
To apply, pl send your cv in word doc. Pl also include details on your current salary, expected salary and notice period in your cv.
We regret to inform that only shortlisted candidates will be notified.
Posted by:
CAP Consulting (EA license: 14C7175)
Caroline Poh (EA Registration: R1105649)
Date ad is posted -17 April 2020
Job Types: Full-time, Permanent"
"#SGUnitedJobs Data Engineer","GOVERNMENT TECHNOLOGY AGENCY",Singapore,"$4,000 - $6,000 a month","Good understanding of system design, data structure and algorithms, data modelling, data access and data storage.
Understand LDAP, OAuth, API gateways.","Roles & Responsibilities
We are from the Data Engineering Team in GovTech. Our main role is to support agencies in building data infrastructure to manage their data analytics products, so as to support citizen-centric services that serve the needs of Singaporeans. We are expanding our team to scale up our work on on-premise systems and government commercial cloud. We are looking for enthusiastic and passionate data engineers who are keen to work on products and services that improve the lives of citizens and enhance service delivery.

What to Expect:
Build ingest pipelines to collect, clean, harmonise, merge and consolidate data sources
Design and build API gateways to expose data to systems via secure means
Integrate and collate data sources with data systems, with compliance to data security and organisational governance standards
Collaborate with product managers, software engineers, data analysts and data scientists to build scalable and data-driven products
How to Succeed:
Good understanding of system design, data structure and algorithms, data modelling, data access and data storage
Ability to write SQL for databases like Postgres, MongoDB, neo4j
Proficient in programming languages like R, Python and/or Go
Familiar with regular expressions and scripting languages like bash, korn, awk
Prior experience with data engineering tools and frameworks like Airflow, Kafka, Hadoop, Spark, Kubernetes
Comfortable with DevOps tools like Docker, Git, Terraform
Familiar with building and using CI/CD pipelines for platform development
Understand LDAP, OAuth, API gateways
Able to show some work using cloud technologies like Azure, AWS and Google Cloud
Working-level understanding of machine learning is an added advantage
Prior experience in designing, building and maintaining batch and real-time data pipelines is an added advantage
Applicants without experience are welcome to apply [CANDIDATES WHO REQUIRE WORK PASSES NEED NOT APPLY]

[CANDIDATES WHO REQUIRE WORK PASSES NEED NOT APPLY]"
"Senior Data Scientist","Centre for Strategic Infocomm Technologies (CSIT)",Singapore,None,"Experience in leading and managing data science teams.
You will be part of a dynamic team of data specialists responsible for tackling the most complex problems…","CSIT develops products to advance the national security interests of Singapore. Our products are used in a wide range of operations, including but not limited to, Counter-terrorism and Computer Network Defence. We are looking for talented data scientists to build mission critical data-driven products that identify, analyse and disrupt threats.
Role
You will be part of a dynamic team of data specialists responsible for tackling the most complex problems in national security through the use of machine learning and data analytics. You will work with a variety of rich multimodal datasets and high velocity data streams to develop and implement algorithms that drive key business decisions. Our ideal team member will have strong quantitative and computational skills, but will not shy from writing high-quality, extensible and maintainable code.

Responsibilities
Apply statistical and machine learning techniques on large-scale datasets to verifiably address a variety of business needs
Mentor junior team members on machine learning and best practices
Identify high-impact opportunities for applying machine learning and data analytics to solve key business issues
Collaborate closely with business users to extract actionable insights from data and develop data-driven solutions to meet their needs
Keep current with developments in academia and industry
Requirements
Minimum requirements
An advanced degree in a quantitative field (e.g. Computer Science, Economics, Mathematics, Physics etc.) or equivalent practical experience
Experience in applying machine learning techniques (such as classification, anomaly detection and recommendation systems) on non-trivial datasets
Deep understanding of a particular domain (e.g. natural language processing or recommendation systems) with working knowledge of a broader range of machine learning and data mining concepts
Nice-to-haves
Knowledge of big data and streaming technologies such as Hadoop, Spark and Kafka would be an added advantage
Experience in leading and managing data science teams
Strong written and verbal communication skills

As CSIT is an agency under the Ministry of Defence (Singapore), only Singapore Citizens will be considered."
