title,companyname,location,salary,summary,description
"Data Scientist (Human Capital)","GOVERNMENT TECHNOLOGY AGENCY",Singapore,"$5,000 - $8,000 a month","Extract and interpret large data sets from HR Centers of Excellence using complex data analysis.
We are seeking an analytics professional to join us as a Data…","Roles & Responsibilities
The People Organization Group (POG) is the GovTech division that oversees and promotes our human resources. It is in charge of fostering the holistic development and enrichment of our employees, both individually and as a team.
We are seeking an analytics professional to join us as a Data Scientist to develop our advanced HR analytics strategies. You will be given opportunities to apply people analytics using advanced analytics technologies, subsequently making critical decisions to directly impact initiatives and solutions and meet business needs. Success in the role will be demonstrated by your ability to thrive in a fast-paced and dynamic environment.
What to Expect:
Consult with HR and organizational partners to identify business problems
Extract and interpret large data sets from HR Centers of Excellence using complex data analysis
Design holistic analytical reports, articulating and transforming them into actionable people insights for key HR stakeholders
Level-up analytical capabilities for POG by enhancing intellectual programming analytics through integrating current and new HR systems and technologies
Participate in data science studies and projects to discover new analytics technologies
How to Succeed:
At least 2 years of professional experience in data science, business analytics or a related field
In-depth knowledge of basic data science concepts (e.g. machine-learning algorithms, natural language processing, business application of statistics)
Technical expertise in data analysis technologies (e.g. Tableau, Python, R, SAS) and database development tools (e.g. SQL, Hadoop)
Excellent communication (written and verbal) and stakeholder-management skills
Self-starter and passionate in data analysis [CANDIDATES WHO REQUIRE WORK PASSES NEED NOT APPLY]

[CANDIDATES WHO REQUIRE WORK PASSES NEED NOT APPLY]"
"Associate Scientist","Merck KGaA",Singapore,None,"Computer literacy and entry of data into databases (LIMS, ELN, SAP, etc.).
Accurately and promptly records data to meet appropriate scientific and GLP/GMP…","YOUR ROLE:
As Associate Scientist you will be part of the Process Solutions Services team that designs and delivers Viral Clearance validation studies for biopharmaceutical companies across the APAC region. In this role you will conduct a variety of tasks to support GLP/ GMP operations, perform cell culture and virus titration assays, and maintain the testing laboratories and equipment in the validated state. You will carry out client studies with appropriate regulatory compliance under the oversight of the Study Director and work side-by-side with onsite clients, independently performing client activities and viral inactivations as required. As part of your daily responsibilities you will also initiate and support investigations, lead lab improvement projects, and generate SOP’s as required. The Associate Scientist will work closely with the scientists and laboratory personnel to execute client studies on time and right first time.

Brief role description:
Works within the Viral Clearance laboratories following Standard Operating Procedures (SOP) and relevant compliance regulations
Performs cell culture and virus titration assays to ensure routine studies are completed on time
Accurately and promptly records data to meet appropriate scientific and GLP/GMP regulatory standards
Works side-by-side with onsite clients performing scale-down purification operations in the lab
Independently performs virus spiking, sample preparation and virus inactivation operations
Performs investigations, handles deviations and owns CAPAs and change controls at site level
May perform lab-scale chromatographic processes and virus filtrations as required
Coaches and trains junior team members on lab procedures and systems
Carries out housekeeping, performs environmental monitoring activities and maintains stock control in the laboratory as required
Ensures a safe and healthy work environment at all times by not only complying with but actively embracing health and safety policies and procedures, ensuring the safety of yourself and others within the workplace
Ensures equipment is maintained in the validated state and works with facility department to ensure timely implementation of periodic maintenance and calibration.
Leads lab projects related to equipment validations, continuous improvement, CAPA’s, assay trending, etc
Generates SOP’s and lab records as required

WHO YOU ARE:
Education:
Bachelor degree in Biological Sciences or higher degree in relevant scientific subject
Experience:
Minimum 2 years of experience in a regulated environment (GLP/GMP)
Minimum 2 years of experience in a scientific laboratory role
Prior experience in any of the following areas will be advantageous:
Hands-on experience in cell culture and/or virology
Demonstrable scientific understanding in downstream bioprocessing (filtration & chromatography)
Hands-on experience with Akta chromatographic systems
Knowledge & Skills:
Computer literacy and entry of data into databases (LIMS, ELN, SAP, etc.)
Ability to complete documentation (both handwritten and electronic) neatly and accurately
English fluency in speaking and writing. Practical knowledge of Japanese and/or Korean is a plus.
Core competencies:
Safety and Quality
Adheres to health and safety procedures and actively takes necessary action when encountering unsafe situations
Is organized and pays attention to detail
Adheres to SOPs and protocols, and ensures compliance to site policies and regulations
Problem solving and drive
Can learn new skills and knowledge quickly
Uses logic to solve problems with effective solutions
Enjoys working hard; is action-oriented and determined to provide best-in-class service
Pursues everything with energy, drive and the need to finish, especially in the face of resistance or setbacks
Personal and interpersonal skills
Relates well to all kinds of people in the organization, builds constructive and effective relationships using diplomacy and tact
Is seen as a team player, cooperative and encourages collaboration
Is customer oriented and able to relate with clients from different cultures
The ability to maintain effective working relationships with scientists and other lab personnel will be critical for success in the role



Job Requisition ID: 205480
Location: Singapore
Career Level: C - Professional (1-3 years)
Working time model: full-time
US Disclosure
The Company is an Equal Employment Opportunity employer. No employee or applicant for employment will be discriminated against on the basis of race, color, religion, age, sex, sexual orientation, national origin, ancestry, disability, military or veteran status, genetic information, gender identity, transgender status, marital status, or any other classification protected by applicable federal, state, or local law. This policy of Equal Employment Opportunity applies to all policies and programs relating to recruitment and hiring, promotion, compensation, benefits, discipline, termination, and all other terms and conditions of employment. Any applicant or employee who believes they have been discriminated against by the Company or anyone acting on behalf of the Company must report any concerns to their Human Resources Business Partner, Legal, or Compliance immediately. The Company will not retaliate against any individual because they made a good faith report of discrimination.

North America Disclosure
The Company is committed to accessibility in its workplaces, including during the job application process. Applicants who may require accommodation during the application process should speak with our HR Services team at 855 444 5678 from 8:00am to 5:30pm ET Monday through Friday."
"Senior Manager, Analytics Products and Services","STARHUB LTD.",Singapore,"$9,000 - $11,500 a month","Deep dive into massive amount of data, performing analysis, developing new data science and AI models to create new value proposition with Data Products.","Roles & Responsibilities
Responsibilities
Successful candidates will be working with massive amounts of data to develop Machine Learning and Artificial Intelligence (AI) models with Telco and other sets of data to help enterprises realise key business value. The candidate will work closely key internal and external stakeholders to develop new Data Products or new Application areas in analytics and AI. Our executive data scientist would enjoy thinking out of the box and be a proponent of collaboration with the industry and research institutes to create new value proposition from Data.
Responsibilities:
1. Deep dive into massive amount of data, performing analysis, developing new data science and AI models to create new value proposition with Data Products.
2. Utilize in-depth knowledge of modern data driven methods and fuse with industry domain understanding to deliver data driven digital offerings.
3. Strong technical leadership and is able to play a mentorship role to data scientists.
4. Keen eye for opportunities on value creation with applied data science and AI. Be a thought leader in the area of applied analytics and AI.
5. Proactively engage industry collaborators or research institutes to identify potential new opportunities for technical collaboration.
6. Work closely with business stakeholders for technical innovation in green field areas for potential commercial upside.
Requirements
1. At least a Master’s degree in Statistics, Machine Learning, Mathematics, Computer Science, Economics, or any other related quantitative field.
2. At least 10+ years of direct experience in leading a technical team, in collaboration with business leaders supporting multi-projects related to analytics, machine learning or AI.
3. Expert in applying machine learning, artificial intelligence, statistics, and computational techniques to solve real world challenges using Telco and heterogeneous data
a. Provide Technical Leadership in Deep Learning frameworks like Tensorflow, Keras
b. Deep understanding of various algorithms in Data Science Models e.g. Clustering, Neural Networks, Random Forests
c. Familiarity with Big Data Technologies
d. Experience in Data Products development
4. Attention to details and strong resource management and organizational skills
5. Strong people skills with a technical vision
6. Clear and effective communication skills (verbal and written) and ability to develop and maintain good relations and communicate with people at all hierarchical levels
7. Ability to drive technical innovation with a keen eye on business opportunities
We regret that only shortlisted candidates will be notified. [CANDIDATES WHO REQUIRE WORK PASSES NEED NOT APPLY]

[CANDIDATES WHO REQUIRE WORK PASSES NEED NOT APPLY]"
"Big Data Engineer",CITI,"Central Singapore",None,"You will work closely with product owners, data scientist and team members to deliver solutions through new and existing channels.","Job Purpose:
We are looking for a Big Data Engineer to join our team creating new pipelines to process and learn from financial data. You will work closely with product owners, data scientist and team members to deliver solutions through new and existing channels.
Job Background/context:
We believe the future is with us !
Home to where we define, ideate, develop and distribute production-ready financial solutions of far-reaching impact. And right now, the door’s open to direct the future of our technology for a truly global client base. This means collaborating with the keenest minds in data science, big data, software engineering, web development, UX design and more. Doers looking to bring the next bold ideas to life for a fascinating array of clients - investing, trading and transacting at the forefront of change in markets and economies the world over.
If you have this kind of vision, capable of seeing ahead, of developing a clear path forward in a quest to try the as yet untried, here is the opportunity. In a supported, resource-rich, vibrant co-working environment, part of an ecosystem of globally interconnected labs, realising a broader mission of enabling growth and economic progress on a scale you won’t find anywhere else. Welcome to our APAC Cross Markets Analytics & Digitization (CMAD), Team
Key Responsibilities:
Architect and process complex datasets with Spark, Beam, etc
Read/write data with Kafka, HDFS, S3, etc
Produce fault-tolerant, intelligent data processing pipelines
Skills & Qualifications:
You have a great understanding of the Python language and standard library
You understand how to use a data processing framework, such as Apache Spark or Beam
You know how to read/write data to message and storage platforms, such as Apache Kafka, HDFS or Amazon S3
You are interested in creating data processing pipelines for machine learning, using Apache Airflow, Dask, etc
You have very high development standards, especially for code quality, code reviews, unit testing, continuous integration and deployment
You are an adaptable, resourceful, well organised team player with a strong work ethic
You agree that verbal and written communication skills are vital
You are educated to degree level or above
-
Grade :
-
Time Type :Full time
-
Citi is an equal opportunity and affirmative action employer.
Minority/Female/Veteran/Individuals with Disabilities/Sexual Orientation/Gender Identity.
Citigroup Inc. and its subsidiaries ("Citi”) invite all qualified interested applicants to apply for career opportunities. If you are a person with a disability and need a reasonable accommodation to use our search tools and/or apply for a career opportunity .
To view the "EEO is the Law" poster . To view the EEO is the Law Supplement .
To view the EEO Policy Statement .
To view the Pay Transparency Posting ."
"Software Engineer (Full-Stack / NodeJS / ReactJS)","emporio analytics Pte. Ltd.",Singapore,None,"We are a very dynamic team of Data Scientists, Data Engineers, Consultants, Software Engineers, Sales and Marketing.
Degree in Computer Science or equivalent.","We are looking for a passionate and driven Full-Stack Developer to our fast growing team in Singapore. We are a very dynamic team of Data Scientists, Data Engineers, Consultants, Software Engineers, Sales and Marketing.

Work closely with Product, Data Engineering and Data Scientists team to design, prototype and build new products and features to the ongoing development.
Taking part in requirement analysis, software design, follow TDD practices to perform tests and develop the modules, APIs and frontend apps.
Applying best practices to what you do and sharing the knowledge with the team is a key
Working in a development team that follows the best practices of Agile and SCRUM to achieve tasks in a given sprint.
Degree in Computer Science or equivalent
Minimum 3 years experience in Full-Stack development using NodeJS and ReactJS is a must. Experience in Ruby on Rails is an added advantage.
Deep understanding of the best programming practices, test-driven development, code reviews, continuous integration and common design patterns.
Experience working with MicroServices architecture, managing multiple REST APIs
Experience with relational databases with the ability to optimise queries and work with performance oriented tasks
Experience with NoSQL databases such as MongoDB, Redis or Elasticsearch.
Good to have: Experience working with ECS, Docker and Kubernetes
Good to have: Experience with CI tools like Bitbucket pipelines or Jenkins
Excellent communication skills and the ability to work well with others"
"Technology & Analytics Consultant",IQVIA,Singapore,None,"Working with data scientists and analysts to ensure that wherever possible, solutions make best use of data and analytical components.","IQVIA™ is the leading human data science company focused on helping healthcare clients find unparalleled insights and better solutions for patients. Formed through the merger of IMS Health and Quintiles, IQVIA offers a broad range of solutions that harness the power of healthcare data, domain expertise, transformative technology, and advanced analytics to drive healthcare forward.
The Opportunity
IQVIA’s Real World Group is currently recruiting for a Technology & Analytics Consultant to focus on insights platforms, Natural Language Processing (NLP) and AI/ML. The successful applicant will have the opportunity to work with experienced consultants, researchers and data scientists to support the design, development and delivery of a wide range projects in the life sciences space. Assignments range in complexity and delivery model, from developing new solutions to address specific client problems, to taking global and regional solutions to new clients. The role will require flexibility and creativity in the successful application of technology and analytics to address client needs, as well as collaborating with external partners and providers.
Assignment Scope & Learning Opportunities:
(In collaboration with Principals and other team members)
Work in a client facing environment to capture requirements, identify solution components, develop solution concepts and drive the solution design and architecture for insights platforms
Develop a deep understanding the business context into which solutions will be deployed, and building value propositions and business cases to highlight the benefits of developing existing solutions or deploying new ones
Assisting with business development (e.g. opportunities identification and scoping) and proposal writing for untapped client segments
Conducting background research to drive requirements and solution development, by performing quantitative and qualitative analyses, review of research and documents and discussing with subject matter experts
Understanding specific solution considerations based on certain user group requirements and therapy area specific factors
Leading project delivery including managing projects, creating reports, presentations and other client deliverables, leading client meetings and workshops
Ensuring successful delivery of technical components, working with developer and qc teams to ensure clients can get the most value from well tested and successfully deployed platforms
Working with data scientists and analysts to ensure that wherever possible, solutions make best use of data and analytical components
The role will involve being trained on multiple IQVIA solutions, as well as doing self-learning to continually develop knowledge and skills
Skills & Experience Required
Tertiary degree in a relevant discipline e.g. computer science, information systems, engineering, informatics, analytics, data science
Ideally brings 6 to 10 years of professional experience in the development and deployment of technology solutions, with a focus on solutions that have analytical or informatic components
Excellent written and verbal communication skills required
Great interpersonal skills including ability to work effectively with others in and across the organization, including remotely in other time-zones, to accomplish team goals
Strong problem solving, analytical & project management skills
Good level of adaptability and an ability to learn quickly and apply new knowledge
Proficiency in PC applications, Excel and PowerPoint
Additional Skills & Experience of Value
Experience in technology related quality control and assurance
Experience of working with software vendors and third-party service providers to deliver projects
Prior experience in working with health organisations, governments and life science companies
Experience in using and applying Agile methodologies
Development experience
Change management experience
Business development or sales experience
Relevant academic achievements in healthcare or business management
Join Us
Making a positive impact on human health takes insight, curiosity, and intellectual courage. It takes brave minds, pushing the boundaries to transform healthcare. Regardless of your role, you will have the opportunity to play an important part in helping our clients drive healthcare forward and ultimately improve outcomes for patients.
Forge a career with greater purpose, make an impact, and never stop learning.

Job ID: R1114556"
"Data Engineer",Nugit,Singapore,None,"Work with different data providers to integrate their data into Nugit’s pipeline.
Our AI technology makes building and sharing data stories easy so everyone can…","Backed by global leading venture capitalists Sequoia and Wavemaker, Nugit is expanding its team to help build the future of data storytelling. Our AI technology makes building and sharing data stories easy so everyone can be a great data storyteller. Companies such as Johnson & Johnson, Audi, Fave, Kellogg’s, and PropertyGuru use Nugit’s platform to give everyone access to data to do their jobs well.

We are hiring Data Engineers to join our team and build the next generation of Nugit’s ETL pipeline.
This is your chance to work at the forefront of technology. You will have the freedom to design and implement scalable systems that utilise modern frameworks all while applying Software Engineering best practices and working with a diverse and talented team of engineers.

Nugit’s team comes from more than 12 different countries specialising in a broad range of technologies and areas such as Design, Data Engineering, DevOps, Visualisation and SaaS applications. Everyone contributes their unique skills and experience to create an environment that is ripe for learning and challenging oneself while delivering value to the business.

Working closely with various members of the Product, API and Frontend Visualisation teams, you will be responsible for implementing Nugit’s ETL pipeline and will thus play a vital role in converting the customer’s data into valuable business insights.

Core Responsibilities
Implement Extract, Transform and Load processes within the Nugit data pipeline
Assist in improving app architectures – Explore existing systems and determine areas of maintainability, scalability and extensibility
Work with different data providers to integrate their data into Nugit’s pipeline
Contribute to continual improvement by identifying and incorporating new and emerging ETL technology
Build reusable components across different data providers



For this role, we are seeking talented individuals who matches below profile:
Demonstrable experience in writing / maintaining ETL pipelines
Experience with Python
Experience with SQL/ NoSQL databases
Experience with GNU/Linux or Unix systems
Strong focus on writing clean, reliable and maintainable code
Strong focus on test coverage and documentation
Fluency with Git and Github
Familiarity with Spark & Scala is a plus
Familiarity with Airflow is a plus
Interest or experience with functional programming languages is a plus
General Skills
You are entrepreneurial - you’re an independent thinker and a problem solver
You are effective – you use version control with git, you work fast, ship product and you get stuff done
You are a team player - you want to work with engineers, designers and data scientists from all over the world
You are adaptable - you embrace the fast paced and always changing nature of a startup
You are remarkable - you can show us real world examples of the amazing stuff you have built in the past
You are curious and a fast learner"
